### ISSUE TITLE
File Format Error - DENON CEOL N9

### ISSUE THREAD

**Issue by Essoloani** [milaq/YCast#93]
Hello,
I have the arrow which indicates current reading, the circle of the current loading and the buffer which remains at 0%. After a few seconds I have an error message: "File Format Error" then playback goes to the next channel.
Regards,

**Comment by Essoloani** [comment]
`# python3 -m ycast -d -l 192.168.1.24 -p 8010 -c /home/pi/ycast-denon/stations.yml
2021-03-02 21:43:41 INFO: YCast (1.1.0) server starting
2021-03-02 21:43:41 DEBUG: Debug logging enabled
 * Serving Flask app "ycast.server" (lazy loading)
 * Environment: production
   WARNING: This is a development server. Do not use it in a production deployment.
   Use a production WSGI server instead.
 * Debug mode: off
Traceback (most recent call last):
  File "/usr/local/lib/python3.9/runpy.py", line 197, in _run_module_as_main
    return _run_code(code, main_globals, None,
  File "/usr/local/lib/python3.9/runpy.py", line 87, in _run_code
    exec(code, run_globals)
  File "/usr/local/lib/python3.9/site-packages/ycast/__main__.py", line 34, in <module>
    launch_server()
  File "/usr/local/lib/python3.9/site-packages/ycast/__main__.py", line 26, in launch_server
    server.run(arguments.config, arguments.address, arguments.port)
  File "/usr/local/lib/python3.9/site-packages/ycast/server.py", line 33, in run
    app.run(host=address, port=port)
  File "/usr/local/lib/python3.9/site-packages/flask/app.py", line 990, in run
    run_simple(host, port, self, **options)
  File "/usr/local/lib/python3.9/site-packages/werkzeug/serving.py", line 1052, in run_simple
    inner()
  File "/usr/local/lib/python3.9/site-packages/werkzeug/serving.py", line 996, in inner
    srv = make_server(
  File "/usr/local/lib/python3.9/site-packages/werkzeug/serving.py", line 847, in make_server
    return ThreadedWSGIServer(
  File "/usr/local/lib/python3.9/site-packages/werkzeug/serving.py", line 740, in __init__
    HTTPServer.__init__(self, server_address, handler)
  File "/usr/local/lib/python3.9/socketserver.py", line 452, in __init__
    self.server_bind()
  File "/usr/local/lib/python3.9/http/server.py", line 138, in server_bind
    socketserver.TCPServer.server_bind(self)
  File "/usr/local/lib/python3.9/socketserver.py", line 466, in server_bind
    self.socket.bind(self.server_address)
OSError: [Errno 98] Address already in use
`

**Comment by Essoloani** [comment]
Now I have very smooth Radiobrowser browsing.
No one to tell me where to look to resolve the format problem?

**Comment by Essoloani** [comment]
14:10:42.226411 IP DENONN9.lan.1278 > RASPBERRYPI.domain: 21010+ A? masima.rastream.com. (37)
14:10:44.213253 IP DENONN9.lan.1278 > RASPBERRYPI.domain: 21010+ A? masima.rastream.com. (37)
14:10:47.465491 IP DENONN9.lan.mdns > 224.0.0.251.mdns: 0*- [0q] 3/0/3 (Cache flush) SRV DENONN9.local.:1024 0 0, (Cache flush) SRV DENONN9.local.:1024 0 0, (Cache flush) A 192.168.1.17 (189)
14:10:48.613300 IP DENONN9.lan.1278 > RASPBERRYPI.domain: 21010+ A? masima.rastream.com. (37)
14:10:57.413632 IP DENONN9.lan.1278 > RASPBERRYPI.domain: 21010+ A? masima.rastream.com. (37)
14:11:02.227986 IP DENONN9.lan.1441 > RASPBERRYPI.8010: Flags [S], seq 2180318, win 65535, options [mss 1460], length 0
14:11:02.228069 IP RASPBERRYPI.8010 > DENONN9.lan.1441: Flags [S.], seq 2570386106, ack 2180319, win 64240, options [mss 1460], length 0
14:11:02.229629 IP DENONN9.lan.1442 > RASPBERRYPI.8010: Flags [S], seq 2244445, win 65535, options [mss 1460], length 0
14:11:02.229689 IP RASPBERRYPI.8010 > DENONN9.lan.1442: Flags [S.], seq 3656105496, ack 2244446, win 64240, options [mss 1460], length 0
14:11:02.231029 IP DENONN9.lan.1441 > RASPBERRYPI.8010: Flags [.], ack 1, win 65535, length 0
14:11:02.231949 IP DENONN9.lan.1441 > RASPBERRYPI.8010: Flags [P.], seq 1:262, ack 1, win 65535, length 261
14:11:02.232012 IP RASPBERRYPI.8010 > DENONN9.lan.1441: Flags [.], ack 262, win 63979, length 0
14:11:02.236497 IP DENONN9.lan.1442 > RASPBERRYPI.8010: Flags [.], ack 1, win 65535, length 0
14:11:02.236674 IP DENONN9.lan.1442 > RASPBERRYPI.8010: Flags [P.], seq 1:216, ack 1, win 65535, length 215
14:11:02.236727 IP RASPBERRYPI.8010 > DENONN9.lan.1442: Flags [.], ack 216, win 64025, length 0
14:11:02.248181 IP RASPBERRYPI.8010 > DENONN9.lan.1442: Flags [P.], seq 1:25, ack 216, win 64025, length 24
14:11:02.249142 IP RASPBERRYPI.8010 > DENONN9.lan.1442: Flags [FP.], seq 25:394, ack 216, win 64025, length 369
14:11:02.251391 IP DENONN9.lan.1442 > RASPBERRYPI.8010: Flags [.], ack 25, win 65511, length 0
14:11:02.254631 IP DENONN9.lan.1442 > RASPBERRYPI.8010: Flags [.], ack 395, win 65151, length 0
14:11:02.260566 IP DENONN9.lan.1442 > RASPBERRYPI.8010: Flags [F.], seq 216, ack 395, win 65535, length 0
14:11:02.260668 IP RASPBERRYPI.8010 > DENONN9.lan.1442: Flags [.], ack 217, win 64025, length 0
14:11:02.267662 IP DENONN9.lan.1279 > RASPBERRYPI.domain: 21266+ A? stream.mangoradio.de. (38)
14:11:02.398787 IP RASPBERRYPI.8010 > DENONN9.lan.1441: Flags [P.], seq 1:18, ack 262, win 63979, length 17
14:11:02.399181 IP RASPBERRYPI.8010 > DENONN9.lan.1441: Flags [.], seq 18:1478, ack 262, win 63979, length 1460
14:11:02.399197 IP RASPBERRYPI.8010 > DENONN9.lan.1441: Flags [.], seq 1478:2938, ack 262, win 63979, length 1460

**Comment by Essoloani** [comment]
16:57:58.131559 IP DENONN9.1063 > RASPBERRYPI.8010: Flags [.], ack 1, win 65535, length 0
16:57:58.133628 IP DENONN9.1063 > RASPBERRYPI.8010: Flags [P.], seq 1:263, ack 1, win 65535, length 262
16:57:58.133673 IP RASPBERRYPI.8010 > DENONN9.1063: Flags [.], ack 263, win 63978, length 0
16:57:58.206969 IP RASPBERRYPI.8010 > DENONN9.1063: Flags [P.], seq 1:18, ack 263, win 63978, length 17
16:57:58.208292 IP RASPBERRYPI.8010 > DENONN9.1063: Flags [FP.], seq 18:744, ack 263, win 63978, length 726
16:57:58.209761 IP DENONN9.1063 > RASPBERRYPI.8010: Flags [.], ack 18, win 65518, length 0
16:57:58.211625 IP DENONN9.1063 > RASPBERRYPI.8010: Flags [.], ack 745, win 64796, length 0
16:57:58.220582 IP DENONN9.1063 > RASPBERRYPI.8010: Flags [F.], seq 263, ack 745, win 65535, length 0
16:57:58.220656 IP RASPBERRYPI.8010 > DENONN9.1063: Flags [.], ack 264, win 63978, length 0
16:57:58.231221 IP DENONN9.1064 > RASPBERRYPI.8010: Flags [S], seq 12889527, win 65535, options [mss 1460], length 0
16:57:58.231272 IP RASPBERRYPI.8010 > DENONN9.1064: Flags [S.], seq 1389146503, ack 12889528, win 64240, options [mss 1460], length 0

**Comment by Essoloani** [comment]
17:05:47.081746 IP DENONN9.1175 > RASPBERRYPI.8010: Flags [.], ack 1, win 65535, length 0
17:05:47.082673 IP DENONN9.1175 > RASPBERRYPI.8010: Flags [P.], seq 1:186, ack 1, win 65535, length 185
17:05:47.082705 IP RASPBERRYPI.8010 > DENONN9.1175: Flags [.], ack 186, win 64055, length 0
17:05:47.084469 IP RASPBERRYPI.8010 > DENONN9.1175: Flags [P.], seq 1:25, ack 186, win 64055, length 24
17:05:47.084727 IP RASPBERRYPI.8010 > DENONN9.1175: Flags [FP.], seq 25:394, ack 186, win 64055, length 369
17:05:47.086693 IP DENONN9.1175 > RASPBERRYPI.8010: Flags [.], ack 25, win 65511, length 0
17:05:47.087782 IP DENONN9.1175 > RASPBERRYPI.8010: Flags [.], ack 395, win 65142, length 0
17:05:47.095316 IP DENONN9.1175 > RASPBERRYPI.8010: Flags [F.], seq 186, ack 395, win 65535, length 0
17:05:47.095348 IP RASPBERRYPI.8010 > DENONN9.1175: Flags [.], ack 187, win 64055, length 0
17:05:47.104409 IP DENONN9.1176 > RASPBERRYPI.8010: Flags [S], seq 13466670, win 65535, options [mss 1460], length 0

**Comment by TomForde1910** [comment]
Found a fix for a similar Problem in my CEOL N8.
You might want to check your Gateway-Settings, see #97

**Comment by Essoloani** [comment]
> 
> 
> Found a fix for a similar Problem in my CEOL N8.
> You might want to check your Gateway-Settings, see #97

Did not solve the problem. I get the following result:
# journalctl -xe
-- Subject: L'unité (unit) phpsessionclean.service a terminé son démarrage
-- Defined-By: systemd
-- Support: https://www.debian.org/support
--
-- L'unité (unit) phpsessionclean.service a terminé son démarrage, avec le résultat done.
avril 20 20:10:01 RASPBERRYPI CRON[2247]: pam_unix(cron:session): session opened for user root by (uid=0)
avril 20 20:10:01 RASPBERRYPI CRON[2248]: (root) CMD (   PATH="$PATH:/usr/sbin:/usr/local/bin/" pihole updatechecker local)
avril 20 20:10:01 RASPBERRYPI CRON[2247]: pam_unix(cron:session): session closed for user root
...
avril 20 20:16:22 RASPBERRYPI avahi-daemon[383]: Registering new address record for IPv6 eth0.*.
avril 20 20:16:22 RASPBERRYPI avahi-daemon[383]: iface.c: avahi_server_add_address() failed: Not supported
avril 20 20:16:22 RASPBERRYPI avahi-daemon[383]: Registering new address record for IPv6 on eth0.*.
avril 20 20:16:22 RASPBERRYPI avahi-daemon[383]: iface.c: avahi_server_add_address() failed: Not supported
avril 20 20:16:22 RASPBERRYPI avahi-daemon[383]: Registering new address record for IPv6 on eth0.*.
avril 20 20:16:22 RASPBERRYPI avahi-daemon[383]: iface.c: avahi_server_add_address() failed: Not supported
avril 20 20:16:22 RASPBERRYPI avahi-daemon[383]: Registering new address record for IPv6 on eth0.*.
avril 20 20:16:22 RASPBERRYPI avahi-daemon[383]: iface.c: avahi_server_add_address() failed: Not supported
avril 20 20:17:01 RASPBERRYPI CRON[2322]: pam_unix(cron:session): session opened for user root by (uid=0)
avril 20 20:17:01 RASPBERRYPI CRON[2323]: (root) CMD (   cd / && run-parts --report /etc/cron.hourly)
avril 20 20:17:01 RASPBERRYPI CRON[2322]: pam_unix(cron:session): session closed for user root
avril 20 20:20:01 RASPBERRYPI CRON[2343]: pam_unix(cron:session): session opened for user root by (uid=0)
avril 20 20:20:01 RASPBERRYPI CRON[2344]: (root) CMD (   PATH="$PATH:/usr/sbin:/usr/local/bin/" pihole updatechecker local)
avril 20 20:20:01 RASPBERRYPI CRON[2343]: pam_unix(cron:session): session closed for user root
avril 20 20:20:21 RASPBERRYPI avahi-daemon[383]: Files changed, reloading.
avril 20 20:20:21 RASPBERRYPI avahi-daemon[383]: No service file found in /etc/avahi/services.
avril 20 20:20:21 RASPBERRYPI sudo[1691]: pam_unix(sudo:session): session closed for user root

**Comment by TomForde1910** [comment]
> avril 20 20:16:22 RASPBERRYPI avahi-daemon[383]: iface.c: avahi_server_add_address() failed: Not supported

I'm far from being a pi-hole expert (so can't help to fix!) but this looks as if your installation does not work properly.
pi-hole is a ingenious software, but ads a complexity that **i** didn't wanted.

Therefor i chose to 
- install the latest Raspberry Pi OS Lite (raspberrypi 5.10.17+ #1403)
- install Bind as Nameserver / DNS by following this HOWTO: 
-- http://radio.marty44.net/yamaha-alternative-vtuner.php
**But** made sure to set **all IPs** for denon, yradio, ... to the IP address of the Raspberry in the vtuner.com.zone file!
- And **without** creating an account at radio.marty44.net i changed to this HOWTO: 
-- http://alriklubbers.com/2020/02/22/install-vtuner-alternative-alongside-pi-hole/
following the instruction from "Install Ycast" on, but skipping the "DNS entry" since i got my Bind setup to do this.

Et viola!
Ycast is running nicely and can be used from my CEOL N8 with Pies-IP set as Primary- and Secondary DNS.

**Comment by Essoloani** [comment]
Hello TomForde1910,
Did you activate the proxy on Denon?
I need to activate the proxy to acquire Radiobrowser on Denon. When I do this Spotify works less well.
I followed the tutorials from [Alrik Lubbers](http://alriklubbers.com/2020/02/22/install-vtuner-alternative-alongside-pi-hole/) and [PC1MH techlog](https://pc1mh-weblog.blogspot.com/2019/10/ycast-on-ubuntu-1804.html).
```
[-]DHCP or Proxy
	
DHCP		OFF
IP Address	192.168.001.017
Subnet Mask	255.255.255.000
Gateway		192.168.001.001
Primary DNS	192.168.001.024
Secondary DNS	000.000.000.000

Proxy		ON
Address		192.168.001.024
Port		08010
```

**Comment by Essoloani** [comment]
I have something that doesn't look correct when using the pi browser.
The browser opens the  _[/var/www/html/index.php](https://www.philedi.net/faq/17-ycast/#question55)_  file when I search for 192.168.1.24, vtuner.com, donon.vtuner.com or denon2.vtuner.com
To access Radiobrowser I have to search exactly: 192.168.1.24:8010/ycast/
Maybe this is the reason why I have to enable the proxy on the Denon AV player.
